{
  "schemaVersion": 3,
  "stackkitsVersion": "v0.53.10",
  "generatedAt": "2026-10-17T12:59:27Z",
  "results": [
    {
      "os": {
        "family": "linux",
        "distribution": "ubuntu",
        "version": "26.04"
      },
      "grade": "unverified",
      "reasonCodes": [
        "current-release-receipt-pending"
      ],
      "lastVerifiedRelease": "v0.50.3"
    },
    {
      "os": {
        "family": "linux",
        "distribution": "ubuntu",
        "version": "24.04"
      },
      "grade": "unverified",
      "reasonCodes": [
        "current-release-receipt-pending"
      ],
      "lastVerifiedRelease": "v0.50.3"
    },
    {
      "os": {
        "family": "linux",
        "distribution": "debian",
        "version": "13"
      },
      "grade": "unverified",
      "reasonCodes": [
        "current-release-receipt-pending"
      ],
      "lastVerifiedRelease": "v0.50.3"
    },
    {
      "os": {
        "family": "linux",
        "distribution": "debian",
        "version": "12"
      },
      "grade": "unverified",
      "reasonCodes": [
        "no-automated-lane"
      ]
    }
  ],
  "virtualization": [
    {
      "id": "proxmox-ve",
      "name": "Proxmox VE",
      "rollout": "kombify Techstack or the Proxmox VE API creates a guest VM; the StackKit installs inside that guest and is reached from the home network.",
      "grade": "unverified",
      "reasonCodes": [
        "current-release-receipt-pending"
      ],
      "lastVerifiedRelease": "v0.35.0"
    }
  ],
  "applications": [
    {
      "useCase": "files",
      "adapter": "standalone-compose",
      "grade": "supported",
      "reasonCodes": [],
      "verifiedPhases": [
        "install",
        "init",
        "generate",
        "apply",
        "setup-files",
        "verify",
        "backup",
        "restore"
      ],
      "lastVerifiedRelease": "v0.53.10"
    },
    {
      "useCase": "photos",
      "adapter": "standalone-compose",
      "grade": "preview",
      "reasonCodes": [
        "restore-failed"
      ],
      "verifiedPhases": [
        "install",
        "init",
        "generate",
        "apply",
        "setup-photos",
        "verify",
        "backup"
      ],
      "lastVerifiedRelease": "v0.46.8"
    },
    {
      "useCase": "vault",
      "adapter": "standalone-compose",
      "grade": "unverified",
      "reasonCodes": [
        "current-release-receipt-pending"
      ],
      "lastVerifiedRelease": "v0.46.8"
    },
    {
      "useCase": "ai",
      "adapter": "standalone-compose",
      "grade": "unverified",
      "reasonCodes": [
        "no-automated-lane"
      ]
    },
    {
      "useCase": "dev",
      "adapter": "standalone-compose",
      "grade": "unverified",
      "reasonCodes": [
        "no-automated-lane"
      ]
    },
    {
      "useCase": "documents",
      "adapter": "standalone-compose",
      "grade": "unverified",
      "reasonCodes": [
        "no-automated-lane"
      ]
    },
    {
      "useCase": "media",
      "adapter": "standalone-compose",
      "grade": "unverified",
      "reasonCodes": [
        "current-release-receipt-pending"
      ],
      "lastVerifiedRelease": "v0.39.7"
    },
    {
      "useCase": "smart-home",
      "adapter": "standalone-compose",
      "grade": "unverified",
      "reasonCodes": [
        "current-release-receipt-pending"
      ],
      "lastVerifiedRelease": "v0.39.7"
    }
  ],
  "environments": [
    {
      "kit": "basement-kit",
      "environment": "ci-vm",
      "name": "Fresh virtual machine in CI",
      "grade": "unverified",
      "reasonCodes": [
        "current-release-receipt-pending"
      ],
      "lastVerifiedRelease": "v0.50.3"
    },
    {
      "kit": "basement-kit",
      "environment": "home-lan-vm",
      "name": "Virtual machine on a home network",
      "grade": "unverified",
      "reasonCodes": [
        "current-release-receipt-pending"
      ],
      "lastVerifiedRelease": "v0.35.0"
    },
    {
      "kit": "cloud-kit",
      "environment": "public-vps",
      "name": "Public VPS with a kombify.me address",
      "grade": "unverified",
      "reasonCodes": [
        "current-release-receipt-pending"
      ],
      "lastVerifiedRelease": "v0.41.0"
    },
    {
      "kit": "modern-homelab",
      "environment": "home-and-vps",
      "name": "Home virtual machine plus public VPS",
      "grade": "unverified",
      "reasonCodes": [
        "current-release-receipt-pending"
      ]
    }
  ]
}
